,product_id,name,price,quantity,category,description,expiration_date,rating,status
113,114,Крыжовник,2160,412,Фрукты,"Отличается высоким содержанием ликопина, каротиноида, полезного для здоровья простаты и кожи.",2017-04-01,5.01,Backorder
114,115,Орловская,7643,203,Напитки,"Обладает антиоксидантными свойствами, защищающими клетки от повреждений.",2023-06-04,0.56,Pending
115,116,Каша из дробленной манной крупы,3757,146,Бакалея,"Помогает поддерживать нормальный уровень апигенина, флавоноида, полезного для здоровья мозга и иммунной системы.",2025-01-23,3.96,Refunded
116,117,Голландский сыр,7864,693,Молочные продукты,Подходит для использования в качестве замены традиционных молочных продуктов.,2019-02-19,4.76,Out of Stock
117,118,Каша из дробленной ячневой крупы,6700,632,Бакалея,"Богат кальцием, необходимым для укрепления костей и зубов.",2000-02-17,4.35,Pending
