,product_id,name,price,quantity,category,description,expiration_date,rating,status
1,2,Малина,9551,495,Фрукты,"Отличается высоким содержанием тиамина, необходимого для нормального функционирования нервной системы.",2017-09-01,3.34,Out of Stock
2,3,Чечевица,7675,576,Овощи,Помогает поддерживать нормальный уровень электролитов в организме.,2022-03-01,4.33,Out of Stock
3,4,Камамбер,293,298,Молочные продукты,"Помогает поддерживать нормальный уровень даидзеина, изофлавона, полезного для здоровья женщин во время менопаузы.",2027-03-14,4.53,Available for Pickup
4,5,Конопляные семена,2689,591,Бакалея,Помогает поддерживать мышечную массу и улучшает спортивные результаты.,2027-05-10,1.98,Sold
5,6,Фольга алюминиевая,6497,986,Товары для дома,"Помогает поддерживать нормальный уровень кверцетина, флавоноида, обладающего антиоксидантными и противовоспалительными свойствами.",2026-07-02,2.98,Backorder
6,7,Яблоко,3168,183,Фрукты,"Помогает поддерживать нормальный уровень тиреоидных гормонов, регулирующих обмен веществ.",2030-01-02,2.78,In Stock
7,8,Груша,5381,304,Фрукты,"Помогает поддерживать нормальный уровень цистеина, аминокислоты, участвующей в синтезе глутатиона.",2027-03-13,4.86,Backorder
8,9,Простокваша,331,460,Молочные продукты,"Может использоваться как основа для приготовления домашних йогуртов, сыров и других молочных продуктов.",2024-03-01,2.93,Awaiting Payment
9,10,Фета,1229,313,Молочные продукты,"Отличается высоким содержанием карнитина, необходимого для преобразования жиров в энергию.",2016-01-02,4.54,Delivered
10,11,Пакеты для путешествий,6035,76,Товары для дома,Помогает предотвратить дефицит витаминов и минералов в организме.,2014-06-21,2.11,Delivered
11,12,Молоко,9258,729,Молочные продукты,"Помогает поддерживать нормальный уровень зеаксантина, каротиноида, важного для здоровья глаз.",2007-08-10,4.82,Returned
12,13,Ивантеевская,7531,46,Напитки,"Помогает поддерживать нормальный уровень ацетилхолина, нейромедиатора, ответственного за память и обучение.",2021-02-02,1.03,Refunded
13,14,Пармезан,5391,365,Молочные продукты,"Помогает поддерживать нормальный уровень гистамина, важного для иммунной системы.",2003-06-19,4.07,Refunded
14,15,Грейпфрут,6380,524,Фрукты,"Помогает поддерживать нормальный уровень гамма-аминомасляной кислоты (GABA), успокаивающего нейромедиатора.",2001-05-04,2.76,Available for Pickup
16,17,Каша из дробленной перловой крупы,1510,833,Бакалея,"Отличается высоким содержанием таурина, необходимого для здоровья глаз и сердца.",2029-02-04,3.66,Backorder
17,18,Пакеты для охоты,5760,249,Товары для дома,"Помогает поддерживать нормальный уровень эндорфинов, гормонов радости и удовольствия.",2026-03-02,3.91,Refunded
18,19,Термосы,7329,936,Товары для дома,"Отличается высоким содержанием астаксантина, мощного антиоксиданта, полезного для кожи и суставов.",2019-02-02,2.94,Awaiting Payment
19,20,Мак семена,7447,320,Бакалея,"Отличается высоким содержанием капсаицина, вещества, ускоряющего метаболизм и уменьшающего боль.",2021-01-04,3.01,On Backorder
20,21,Лимон,5247,969,Фрукты,Отличается хорошей совместимостью с другими продуктами питания.,2014-04-17,1.75,Available for Pickup
21,22,Марьинская,9892,385,Напитки,"Отличается разнообразием вкусов и текстур, что позволяет каждому найти свой любимый продукт.",2007-01-13,2.92,Delivered
22,23,Пакеты для школы,6915,497,Товары для дома,"Отличается высоким содержанием бета-каротина, необходимого для здоровья глаз и кожи.",1999-05-05,1.76,Shipping
23,24,Робот-пылесос,8347,219,Товары для дома,Помогает поддерживать нормальный уровень сахара в крови.,2021-02-04,0.08,Temporarily Unavailable
24,25,Гранат,3004,331,Фрукты,"Помогает поддерживать нормальный уровень кверцетина, флавоноида, обладающего антиоксидантными и противовоспалительными свойствами.",2030-10-01,2.66,Awaiting Payment
25,26,Сметана,9659,252,Молочные продукты,Отличается хорошим сочетанием с различными специями и приправами.,2008-01-15,4.5,Temporarily Unavailable
26,27,Шелковица,1350,869,Фрукты,"Помогает поддерживать нормальный уровень кемпферола, флавоноида, полезного для здоровья сердца и сосудов.",2021-06-17,0.01,On Backorder
27,28,Морковь,1522,629,Овощи,Может использоваться в детском питании начиная с раннего возраста.,2025-02-16,1.24,Sold
28,29,Ессентуки,7214,137,Напитки,"Отличается высоким содержанием капсаицина, вещества, ускоряющего метаболизм и уменьшающего боль.",2020-02-01,3.15,Shipping
29,30,Скалки,2467,512,Товары для дома,Прошел все необходимые сертификации и соответствует международным стандартам.,1998-03-07,2.01,Shipping
30,31,Чеддер,6014,896,Молочные продукты,"Отличается низким содержанием натрия, что делает его безопасным для гипертоников.",2021-06-08,3.83,Out of Stock
31,32,Гауда,4002,584,Молочные продукты,Помогает поддерживать нормальный уровень мочевой кислоты в организме.,2026-07-12,2.09,On Backorder
32,33,Шпинат,4709,490,Овощи,"Помогает поддерживать нормальный уровень кемпферола, флавоноида, полезного для здоровья сердца и сосудов.",2020-02-02,0.6,Temporarily Unavailable
33,34,Дезодорант,3261,458,Товары для дома,Является важным компонентом рациона для поддержания гормонального баланса.,2022-07-09,3.26,Shipping
34,35,Лук-порей,6628,280,Овощи,"Обладает мягким вкусом, который нравится многим потребителям.",2029-08-01,0.92,Cancelled
35,36,Морковь,9597,985,Овощи,Помогает поддерживать оптимальный вес и форму тела.,2020-04-03,3.01,Cancelled
36,37,Пакеты для свадьбы,2951,611,Товары для дома,"Помогает поддерживать нормальный уровень апигенина, флавоноида, полезного для здоровья мозга и иммунной системы.",2027-05-13,0.29,Awaiting Review
37,38,Чечевица,8463,807,Овощи,"Помогает поддерживать нормальный уровень дофамина, гормона, отвечающего за мотивацию и удовольствие.",2014-02-12,4.25,In Stock
38,39,Фарш куриный,4899,611,Мясо,"Отличается высоким содержанием ресвератрола, вещества, обладающего антивозрастными свойствами.",2010-03-02,2.14,On Backorder
39,40,Электрочайник,937,183,Товары для дома,"Отличается высоким содержанием генистеина, изофлавона, полезного для здоровья костей и профилактики рака.",2013-08-06,1.66,Awaiting Payment
40,41,Огурец,8921,402,Овощи,Помогает улучшить когнитивные функции и память.,2030-04-13,1.73,Delivered
41,42,Черника,5311,822,Фрукты,"Отличается высоким содержанием генистеина, изофлавона, полезного для здоровья костей и профилактики рака.",2030-03-08,4.86,In Stock
42,43,Банан,2881,154,Фрукты,Широко используется в традиционной и современной кухне.,2009-11-04,3.33,Awaiting Payment
43,44,Салфетки влажные,5264,686,Товары для дома,Помогает поддерживать нормальный уровень гормонов в организме.,2014-01-03,4.93,Awaiting Review
44,45,Тан,4310,75,Молочные продукты,"Отличается высоким содержанием мирицетина, флавоноида, обладающего антиоксидантными и противовоспалительными свойствами.",2027-01-09,1.87,Refunded
45,46,Чечевица,3495,184,Овощи,"Имеет длительный срок хранения, что позволяет всегда иметь его под рукой.",1999-03-02,1.67,Awaiting Review
46,47,Смоленская,7583,102,Напитки,"Отличается высоким содержанием инозитола, необходимого для здоровья нервной системы.",2029-01-09,2.33,Temporarily Unavailable
47,48,Клубника,467,400,Фрукты,"Отличается высоким содержанием катехинов, мощных антиоксидантов, полезных для сердца и сосудов.",2004-09-03,2.5,Cancelled
48,49,Рулька,6377,97,Мясо,Помогает сохранять бодрость и активность в течение дня.,2023-09-20,1.36,Delivered
49,50,Смородина,810,784,Фрукты,Помогает поддерживать оптимальный вес и форму тела.,2016-01-14,3.3,Backorder
50,51,Российский сыр,1566,929,Молочные продукты,Помогает улучшить когнитивные функции и память.,2018-02-01,1.13,Awaiting Review
51,52,Редис,3977,168,Овощи,"Помогает поддерживать нормальный уровень серотонина, гормона счастья.",2024-05-03,4.3,Awaiting Payment
52,53,Конина,9609,662,Мясо,"Отличается высоким содержанием глютамина, необходимого для восстановления мышц после физических нагрузок.",2019-03-04,2.26,Refunded
53,54,Каша из поленты,947,820,Бакалея,Помогает предотвратить дефицит витаминов и минералов в организме.,2025-01-03,4.8,Available for Pickup
55,56,Растительное масло кукурузное,8356,349,Бакалея,"Отличается высоким содержанием DMAE, вещества, улучшающего умственную деятельность и настроение.",2002-04-06,2.75,Delivered
56,57,Рулька,538,89,Мясо,"Отличается высоким содержанием даидзеина, изофлавона, полезного для здоровья женщин во время менопаузы.",2006-01-08,3.72,Awaiting Review
57,58,Молоко,7567,379,Молочные продукты,"Отличается высоким содержанием таурина, необходимого для здоровья глаз и сердца.",2026-02-16,1.96,Refunded
61,62,Верблюжье молоко,3764,722,Молочные продукты,Помогает поддерживать нормальный уровень триглицеридов в крови.,2014-02-07,4.72,Sold
62,63,Форосская,5248,516,Напитки,"Отличается высоким содержанием рутина, флавоноида, укрепляющего сосуды и улучшающего кровообращение.",2030-01-05,2.25,Awaiting Payment
63,64,Оленина,4895,496,Мясо,Помогает поддерживать нормальный уровень глюкозы в крови.,2013-10-02,0.95,Temporarily Unavailable
64,65,Клубника,2985,810,Фрукты,"Отличается высоким содержанием омега-3 жирных кислот, полезных для сердца.",2010-02-06,0.48,Pending
65,66,Балык,4856,995,Мясо,Помогает поддерживать нормальный уровень кислотности желудка.,2027-08-02,0.22,Shipping
66,67,Тарелки мелкие,4253,871,Товары для дома,Является важным компонентом сбалансированного рациона питания.,2012-10-02,4.53,On Backorder
67,68,Пакеты для корпоратива,5112,682,Товары для дома,Помогает поддерживать нормальный уровень сахара в крови.,1991-09-01,4.97,Returned
68,69,Окра,1307,74,Овощи,Помогает предотвратить развитие остеопороза благодаря высокому содержанию кальция.,2012-03-05,2.17,Pending
69,70,Томская,8881,902,Напитки,"Отличается высоким содержанием холина, необходимого для здоровья мозга и памяти.",2030-02-17,4.93,Backorder
70,71,Пироги с мясом,6574,700,Мясо,"Помогает поддерживать нормальный уровень кверцетина, флавоноида, обладающего антиоксидантными и противовоспалительными свойствами.",2019-06-03,1.57,Awaiting Review
71,72,Щавель,8200,505,Овощи,Помогает улучшить работу мозга и повысить концентрацию внимания.,2009-08-02,1.89,Pending
72,73,Редис,6759,897,Овощи,Помогает поддерживать нормальный уровень холестерина в крови.,2009-01-01,0.44,Backorder
73,74,Фейхоа,4490,911,Фрукты,"Отличается высоким содержанием апигенина, флавоноида, полезного для здоровья мозга и иммунной системы.",2022-01-06,0.22,Cancelled
74,75,Топинамбур,8882,34,Овощи,"Отличается высоким содержанием кверцетина, флавоноида, обладающего антиоксидантными и противовоспалительными свойствами.",2007-05-13,3.21,Available for Pickup
75,76,Смородина,3823,284,Фрукты,Прошел независимые лабораторные исследования и получил положительные отзывы экспертов.,2027-06-01,1.3,Awaiting Review
76,77,Каша из дробленной овсянки,5135,879,Бакалея,Помогает поддерживать нормальный уровень электролитов в организме.,2024-03-01,3.38,Backorder
77,78,Газированная вода,1293,434,Напитки,Помогает укреплять стенки сосудов и улучшать кровообращение.,2024-01-02,1.35,Sold
78,79,Гауда,7932,382,Молочные продукты,"Помогает поддерживать нормальный уровень метионина, аминокислоты, необходимой для детоксикации организма.",2025-02-04,2.98,In Stock
79,80,Лук-порей,2502,360,Овощи,"Отличается высоким содержанием фтора, необходимого для здоровья зубов и костей.",2015-02-01,1.54,Delivered
80,81,Пакеты для микроволновки,1841,255,Товары для дома,"Помогает поддерживать нормальный уровень кемпферола, флавоноида, полезного для здоровья сердца и сосудов.",2011-05-12,2.23,In Stock
81,82,Гамбургеры,4001,758,Мясо,Рекомендуется для включения в рацион беременных женщин и кормящих матерей.,2023-06-11,1.58,Refunded
82,83,Вода,396,333,Напитки,"Отличается длительным сроком годности, что позволяет делать запасы.",2022-01-01,1.05,Cancelled
83,84,Цукини,9307,314,Овощи,"Помогает поддерживать нормальный уровень танинов, веществ, обладающих вяжущими и антисептическими свойствами.",2020-01-04,0.89,Available for Pickup
84,85,Жемчужина Байкала,4497,170,Напитки,"Отличается высоким содержанием катехинов, мощных антиоксидантов, полезных для сердца и сосудов.",2029-10-07,1.9,Shipping
85,86,Масло подсолнечное,7986,737,Бакалея,Подходит для использования в специализированных диетах и лечебных программах.,2023-12-06,4.16,Returned
86,87,Курт,7419,714,Молочные продукты,Отличается высокой эффективностью в борьбе с анемией благодаря содержанию железа.,2029-05-15,0.12,In Stock
87,88,Южно-Сахалинская,949,753,Напитки,"Отличается высоким содержанием коэнзима Q10, необходимого для выработки энергии в клетках.",2028-02-07,2.38,Available for Pickup
88,89,Тверская,2637,287,Напитки,"Помогает поддерживать нормальный уровень 5-гидрокситриптофана (5-HTP), предшественника серотонина.",2024-02-11,0.55,Temporarily Unavailable
89,90,Балаковская,1349,485,Напитки,"Помогает поддерживать нормальный уровень апигенина, флавоноида, полезного для здоровья мозга и иммунной системы.",2008-02-12,0.47,Available for Pickup
90,91,Сало,8603,263,Мясо,Помогает поддерживать нормальный обмен веществ и метаболизм.,2004-07-11,2.11,Cancelled
91,92,Кокос,3008,737,Фрукты,Прошел сертификацию на соответствие требованиям органических стандартов.,2001-02-05,1.57,Backorder
92,93,Апельсин,9276,694,Фрукты,"Помогает поддерживать нормальный уровень ацетилхолина, нейромедиатора, ответственного за память и обучение.",2012-06-03,2.93,Available for Pickup
93,94,Молоко,639,537,Молочные продукты,Отличается простотой в использовании и хранении.,2023-02-21,3.99,Refunded
94,95,Нектарин,3769,678,Фрукты,Помогает улучшить когнитивные функции и память.,2007-05-06,4.92,Temporarily Unavailable
95,96,Кондиционер для волос,5792,513,Товары для дома,Отличается низкой вероятностью возникновения побочных эффектов при употреблении.,2012-05-11,1.9,Delivered
96,97,Горчица зерновая,8352,687,Бакалея,"Помогает поддерживать нормальный уровень кумаринов, веществ, обладающих антикоагулянтными свойствами.",2021-03-03,1.9,Temporarily Unavailable
97,98,Мармелад,2837,280,Бакалея,"Отличается широким ассортиментом вкусов и форматов, удовлетворяя потребности разных категорий потребителей.",2015-09-07,0.18,Out of Stock
98,99,Чувашская,6692,102,Напитки,"Подходит для использования в диетах, направленных на снижение веса.",2027-12-12,2.94,Awaiting Review
99,100,Кострец,383,401,Мясо,"Отличается высоким содержанием антоцианов, пигментов, обладающих антиоксидантными и противовоспалительными свойствами.",2020-08-07,1.18,Available for Pickup
100,101,Кесадилья с мясом,7585,403,Мясо,Помогает предотвратить развитие остеопороза благодаря высокому содержанию кальция.,2011-09-01,0.05,Backorder
101,102,Груша,1082,486,Фрукты,"Помогает поддерживать нормальный уровень тиреоидных гормонов, регулирующих обмен веществ.",2030-04-01,1.69,Delivered
102,103,Пакеты для школы,1342,909,Товары для дома,Является важным элементом спортивного питания для восстановления после тренировок.,2014-05-03,4.85,On Backorder
103,104,Разрыхлитель теста,314,774,Бакалея,"Является источником незаменимых аминокислот, необходимых для построения мышц.",2020-05-04,1.3,In Stock
104,105,Брокколи,3251,567,Овощи,Помогает поддерживать нормальный уровень эстрогенов у женщин.,2016-04-04,2.47,Awaiting Review
105,106,Щавель,2758,231,Овощи,Помогает поддерживать здоровый цвет лица и упругость кожи.,2015-01-04,1.8,Backorder
106,107,Адыгейский сыр,8139,150,Молочные продукты,"Доступен в различных упаковках и форматах, что упрощает выбор подходящего варианта.",2022-02-08,2.27,Backorder
107,108,Куриные бедра,3393,283,Мясо,"Богат кальцием, необходимым для укрепления костей и зубов.",2024-04-12,3.63,Temporarily Unavailable
108,109,Гауда,6515,932,Молочные продукты,"Отличается высоким содержанием фосфора, необходимого для здоровья зубов и костей.",2028-05-07,4.23,Awaiting Review
109,110,Черешня,3239,743,Фрукты,Отвечает всем современным стандартам качества и безопасности.,2022-01-21,0.34,Delivered
110,111,Баклажан,8085,329,Овощи,Помогает поддерживать нормальное функционирование печени и желчного пузыря.,2024-03-13,1.97,Shipping
111,112,Засоленное мясо,1574,527,Мясо,"Отличается высоким содержанием меди, необходимой для синтеза коллагена и эластина.",2010-02-14,3.06,Refunded
112,113,Щавель,9102,237,Овощи,Помогает поддерживать нормальный уровень pH в организме.,2026-10-03,3.52,In Stock
